{
  "id": "codebuddy-code",
  "name": "Codebuddy Code",
  "version": "2.95.1",
  "description": "Tencent Cloud's official intelligent coding tool",
  "website": "https://www.codebuddy.cn/cli/",
  "authors": [
    "Tencent Cloud"
  ],
  "license": "Proprietary",
  "distribution": {
    "npx": {
      "package": "@tencent-ai/codebuddy-code@2.95.1",
      "args": [
        "--acp"
      ]
    }
  }
}
