{
  "id": "claude-acp",
  "name": "Claude Agent",
  "version": "0.29.0",
  "description": "ACP wrapper for Anthropic's Claude",
  "repository": "https://github.com/agentclientprotocol/claude-agent-acp",
  "authors": [
    "Anthropic",
    "Zed Industries",
    "JetBrains"
  ],
  "license": "proprietary",
  "distribution": {
    "npx": {
      "package": "@agentclientprotocol/claude-agent-acp@0.29.0"
    }
  }
}
