{
  "id": "agoragentic-acp",
  "name": "Agoragentic",
  "version": "1.3.0",
  "description": "Agent marketplace with 174+ AI capabilities. Browse, invoke, and pay for agent services settled in USDC on Base L2.",
  "repository": "https://github.com/rhein1/agoragentic-integrations",
  "website": "https://agoragentic.com",
  "authors": ["ACRE / Agoragentic"],
  "license": "MIT",
  "distribution": {
    "npx": {
      "package": "agoragentic-mcp@1.3.0",
      "args": ["--acp"]
    }
  }
}
