{
  "id": "qwen-code",
  "name": "Qwen Code",
  "version": "0.12.5",
  "description": "Alibaba's Qwen coding assistant",
  "repository": "https://github.com/QwenLM/qwen-code",
  "authors": [
    "Alibaba Qwen Team"
  ],
  "license": "Apache-2.0",
  "distribution": {
    "npx": {
      "package": "@qwen-code/qwen-code@0.12.5",
      "args": [
        "--acp",
        "--experimental-skills"
      ]
    }
  }
}
