{
  "id": "cortex-code",
  "name": "Cortex Code",
  "version": "1.0.73",
  "description": "Snowflake's Cortex Code coding agent",
  "repository": "https://docs.snowflake.com/en/user-guide/cortex-code/cortex-code",
  "authors": ["Snowflake"],
  "license": "proprietary",
  "distribution": {
    "binary": {
      "darwin-aarch64": {
        "archive": "https://sfc-repo.snowflakecomputing.com/cortex-code-cli/a4643c4278/1.0.73%2B180523.e6179a031de9/coco-1.0.73%2B180523.e6179a031de9-darwin-arm64.tar.gz",
        "cmd": "./coco-1.0.73+180523.e6179a031de9-darwin-arm64/cortex",
        "args": ["acp", "serve"]
      },
      "darwin-x86_64": {
        "archive": "https://sfc-repo.snowflakecomputing.com/cortex-code-cli/a4643c4278/1.0.73%2B180523.e6179a031de9/coco-1.0.73%2B180523.e6179a031de9-darwin-amd64.tar.gz",
        "cmd": "./coco-1.0.73+180523.e6179a031de9-darwin-amd64/cortex",
        "args": ["acp", "serve"]
      },
      "linux-x86_64": {
        "archive": "https://sfc-repo.snowflakecomputing.com/cortex-code-cli/a4643c4278/1.0.73%2B180523.e6179a031de9/coco-1.0.73%2B180523.e6179a031de9-linux-amd64.tar.gz",
        "cmd": "./coco-1.0.73+180523.e6179a031de9-linux-amd64/cortex",
        "args": ["acp", "serve"]
      },
      "linux-aarch64": {
        "archive": "https://sfc-repo.snowflakecomputing.com/cortex-code-cli/a4643c4278/1.0.73%2B180523.e6179a031de9/coco-1.0.73%2B180523.e6179a031de9-linux-arm64.tar.gz",
        "cmd": "./coco-1.0.73+180523.e6179a031de9-linux-arm64/cortex",
        "args": ["acp", "serve"]
      },
      "windows-x86_64": {
        "archive": "https://sfc-repo.snowflakecomputing.com/cortex-code-cli/a4643c4278/1.0.73%2B180523.e6179a031de9/coco-1.0.73%2B180523.e6179a031de9-windows-amd64.tar.gz",
        "cmd": "./coco-1.0.73+180523.e6179a031de9-windows-amd64/cortex.exe",
        "args": ["acp", "serve"]
      },
      "windows-aarch64": {
        "archive": "https://sfc-repo.snowflakecomputing.com/cortex-code-cli/a4643c4278/1.0.73%2B180523.e6179a031de9/coco-1.0.73%2B180523.e6179a031de9-windows-arm64.tar.gz",
        "cmd": "./coco-1.0.73+180523.e6179a031de9-windows-arm64/cortex.exe",
        "args": ["acp", "serve"]
      }
    }
  }
}
