{
  "id": "nova",
  "name": "Nova",
  "version": "1.1.7",
  "description": "Nova by Compass AI - a fully-fledged software engineer at your command",
  "repository": "https://github.com/Compass-Agentic-Platform/nova",
  "website": "https://www.compassap.ai/portfolio/nova.html",
  "authors": [
    "Compass AI"
  ],
  "license": "proprietary",
  "icon": "./icon.svg",
  "distribution": {
    "npx": {
      "package": "@compass-ai/nova@1.1.7",
      "args": [
        "acp"
      ]
    }
  }
}
