{
  "id": "github-copilot",
  "name": "GitHub Copilot",
  "version": "1.487.0",
  "description": "GitHub's AI pair programmer",
  "repository": "https://github.com/github/copilot-language-server-release",
  "website": "https://github.com/features/copilot/cli/",
  "authors": [
    "GitHub"
  ],
  "license": "proprietary",
  "distribution": {
    "npx": {
      "package": "@github/copilot-language-server@1.487.0",
      "args": [
        "--acp"
      ]
    }
  }
}
