{
  "id": "opencode",
  "name": "OpenCode",
  "version": "1.14.34",
  "description": "The open source coding agent",
  "repository": "https://github.com/anomalyco/opencode",
  "website": "https://opencode.ai",
  "authors": [
    "Anomaly"
  ],
  "license": "MIT",
  "icon": "./icon.svg",
  "distribution": {
    "binary": {
      "darwin-aarch64": {
        "archive": "https://github.com/anomalyco/opencode/releases/download/v1.14.34/opencode-darwin-arm64.zip",
        "cmd": "./opencode",
        "args": [
          "acp"
        ]
      },
      "darwin-x86_64": {
        "archive": "https://github.com/anomalyco/opencode/releases/download/v1.14.34/opencode-darwin-x64.zip",
        "cmd": "./opencode",
        "args": [
          "acp"
        ]
      },
      "linux-aarch64": {
        "archive": "https://github.com/anomalyco/opencode/releases/download/v1.14.34/opencode-linux-arm64.tar.gz",
        "cmd": "./opencode",
        "args": [
          "acp"
        ]
      },
      "linux-x86_64": {
        "archive": "https://github.com/anomalyco/opencode/releases/download/v1.14.34/opencode-linux-x64.tar.gz",
        "cmd": "./opencode",
        "args": [
          "acp"
        ]
      },
      "windows-aarch64": {
        "archive": "https://github.com/anomalyco/opencode/releases/download/v1.14.34/opencode-windows-arm64.zip",
        "cmd": "./opencode",
        "args": [
          "acp"
        ]
      },
      "windows-x86_64": {
        "archive": "https://github.com/anomalyco/opencode/releases/download/v1.14.34/opencode-windows-x64.zip",
        "cmd": "./opencode.exe",
        "args": [
          "acp"
        ]
      }
    }
  }
}
