{
  "id": "mistral-vibe",
  "name": "Mistral Vibe",
  "version": "2.5.0",
  "description": "Mistral's open-source coding assistant",
  "repository": "https://github.com/mistralai/mistral-vibe",
  "website": "https://mistral.ai/products/vibe",
  "authors": ["Mistral AI"],
  "license": "Apache-2.0",
  "icon": "./icon.svg",
  "distribution": {
    "binary": {
      "darwin-aarch64": {
        "archive": "https://github.com/mistralai/mistral-vibe/releases/download/v2.5.0/vibe-acp-darwin-aarch64-2.5.0.zip",
        "cmd": "./vibe-acp"
      },
      "darwin-x86_64": {
        "archive": "https://github.com/mistralai/mistral-vibe/releases/download/v2.5.0/vibe-acp-darwin-x86_64-2.5.0.zip",
        "cmd": "./vibe-acp"
      },
      "linux-aarch64": {
        "archive": "https://github.com/mistralai/mistral-vibe/releases/download/v2.5.0/vibe-acp-linux-aarch64-2.5.0.zip",
        "cmd": "./vibe-acp"
      },
      "linux-x86_64": {
        "archive": "https://github.com/mistralai/mistral-vibe/releases/download/v2.5.0/vibe-acp-linux-x86_64-2.5.0.zip",
        "cmd": "./vibe-acp"
      },
      "windows-aarch64": {
        "archive": "https://github.com/mistralai/mistral-vibe/releases/download/v2.5.0/vibe-acp-windows-aarch64-2.5.0.zip",
        "cmd": "./vibe-acp.exe"
      },
      "windows-x86_64": {
        "archive": "https://github.com/mistralai/mistral-vibe/releases/download/v2.5.0/vibe-acp-windows-x86_64-2.5.0.zip",
        "cmd": "./vibe-acp.exe"
      }
    }
  }
}
