{
  "id": "kimi",
  "name": "Kimi CLI",
  "version": "1.36.0",
  "description": "Moonshot AI's coding assistant",
  "repository": "https://github.com/MoonshotAI/kimi-cli",
  "website": "https://moonshotai.github.io/kimi-cli/",
  "authors": [
    "Moonshot AI"
  ],
  "license": "MIT",
  "distribution": {
    "binary": {
      "darwin-aarch64": {
        "archive": "https://github.com/MoonshotAI/kimi-cli/releases/download/1.36.0/kimi-1.36.0-aarch64-apple-darwin.tar.gz",
        "cmd": "./kimi",
        "args": [
          "acp"
        ]
      },
      "linux-aarch64": {
        "archive": "https://github.com/MoonshotAI/kimi-cli/releases/download/1.36.0/kimi-1.36.0-aarch64-unknown-linux-gnu.tar.gz",
        "cmd": "./kimi",
        "args": [
          "acp"
        ]
      },
      "linux-x86_64": {
        "archive": "https://github.com/MoonshotAI/kimi-cli/releases/download/1.36.0/kimi-1.36.0-x86_64-unknown-linux-gnu.tar.gz",
        "cmd": "./kimi",
        "args": [
          "acp"
        ]
      },
      "windows-x86_64": {
        "archive": "https://github.com/MoonshotAI/kimi-cli/releases/download/1.36.0/kimi-1.36.0-x86_64-pc-windows-msvc.zip",
        "cmd": "./kimi.exe",
        "args": [
          "acp"
        ]
      }
    }
  }
}
