{
  "id": "goose",
  "name": "goose",
  "version": "1.28.0",
  "description": "A local, extensible, open source AI agent that automates engineering tasks",
  "repository": "https://github.com/block/goose",
  "website": "https://block.github.io/goose/",
  "authors": ["Block"],
  "license": "Apache-2.0",
  "distribution": {
    "binary": {
      "darwin-aarch64": {
        "archive": "https://github.com/block/goose/releases/download/v1.28.0/goose-aarch64-apple-darwin.tar.bz2",
        "cmd": "./goose",
        "args": ["acp"]
      },
      "darwin-x86_64": {
        "archive": "https://github.com/block/goose/releases/download/v1.28.0/goose-x86_64-apple-darwin.tar.bz2",
        "cmd": "./goose",
        "args": ["acp"]
      },
      "linux-aarch64": {
        "archive": "https://github.com/block/goose/releases/download/v1.28.0/goose-aarch64-unknown-linux-gnu.tar.bz2",
        "cmd": "./goose",
        "args": ["acp"]
      },
      "linux-x86_64": {
        "archive": "https://github.com/block/goose/releases/download/v1.28.0/goose-x86_64-unknown-linux-gnu.tar.bz2",
        "cmd": "./goose",
        "args": ["acp"]
      },
      "windows-x86_64": {
        "archive": "https://github.com/block/goose/releases/download/v1.28.0/goose-x86_64-pc-windows-msvc.zip",
        "cmd": "./goose-package\\goose.exe",
        "args": ["acp"]
      }
    }
  }
}
